equipment_type,series,location_notes
Skid Steer,R-series,"Model & serial decal commonly on the left chassis upright; record the Product Identification Number (PIN) exactly as shown."
Skid Steer,V-series,"Model & serial decal commonly on the left chassis upright; record the Product Identification Number (PIN) exactly as shown."
Track Loader,RT-series,"Product plate and stamped serial as documented in operator manual; record the full PIN for parts/service."
Telehandler,RS-series,"Product plate and stamped serial as documented in operator manual; record the full PIN for parts/service."
Articulated Loader,AL-series,"Use the machine's Product/ID plate; record the full serial exactly as shown for parts documentation."
